[
  {
    "id": 10,
    "name": "stone_basilisk",
    "display_name": "Stone Basilisk",
    "disposition": "boss",
    "max_health": 60,
    "move_speed": 0.8,
    "model": 2,
    "spawn_biomes": ["rolling_hills"],
    "biome": "mountains",
    "boss_pattern": "stomp",
    "calm_reward": "colossus_drops"
  },
  {
    "id": 11,
    "name": "dim_ramlord",
    "display_name": "Dim Ramlord",
    "disposition": "boss",
    "max_health": 80,
    "move_speed": 1.5,
    "model": 3,
    "spawn_biomes": ["dim_barrens"],
    "biome": "any",
    "boss_pattern": "summon_helpers",
    "calm_reward": "herald_drops"
  }
]
