[
  {
    "id": 1,
    "name": "sky_necker",
    "display_name": "Sky-Necker",
    "disposition": "passive",
    "max_health": 10,
    "move_speed": 1.5,
    "spawn_biomes": ["verdant_meadow", "rolling_hills"],
    "biome": "plains",
    "breeds": true,
    "befriend_item": "berry_cluster",
    "calm_reward": "lamb_drops"
  },
  {
    "id": 2,
    "name": "sand_skink",
    "display_name": "Sand Skink",
    "disposition": "skittish",
    "max_health": 6,
    "move_speed": 3.0,
    "spawn_biomes": ["verdant_meadow", "pine_forest"],
    "biome": "desert",
    "breeds": true,
    "befriend_item": "berry_cluster",
    "calm_reward": "rabbit_drops"
  },
  {
    "id": 3,
    "name": "curl_horn_ram",
    "display_name": "Curl-Horn Ram",
    "disposition": "passive",
    "max_health": 14,
    "move_speed": 1.2,
    "spawn_biomes": ["verdant_meadow", "rolling_hills"],
    "biome": "mountains",
    "breeds": true,
    "befriend_item": "berry_cluster",
    "calm_reward": "cow_drops"
  },
  {
    "id": 4,
    "name": "river_fox",
    "display_name": "River Fox",
    "disposition": "skittish",
    "max_health": 8,
    "move_speed": 2.0,
    "spawn_biomes": ["river_delta"],
    "biome": "beach",
    "breeds": true,
    "befriend_item": "berry_cluster",
    "calm_reward": "duck_drops"
  },
  {
    "id": 5,
    "name": "puff_chick",
    "display_name": "Puff Chick",
    "disposition": "passive",
    "max_health": 4,
    "move_speed": 2.5,
    "spawn_biomes": ["verdant_meadow"],
    "biome": "plains",
    "befriend_item": "flower_yellow",
    "calm_reward": "bee_drops"
  },
  {
    "id": 6,
    "name": "moss_turtle",
    "display_name": "Moss Turtle",
    "disposition": "passive",
    "max_health": 12,
    "move_speed": 1.0,
    "spawn_biomes": ["pine_forest"],
    "biome": "swamp",
    "befriend_item": "berry_cluster",
    "calm_reward": "fox_drops"
  },
  {
    "id": 12,
    "name": "snow_fox",
    "display_name": "Snow Fox",
    "disposition": "skittish",
    "max_health": 10,
    "move_speed": 3.5,
    "spawn_biomes": ["frost_tundra"],
    "biome": "snowy",
    "spawn_light_max": 15,
    "befriend_item": "berry_cluster",
    "calm_reward": "snow_fox_drops"
  },
  {
    "id": 13,
    "name": "dune_chick",
    "display_name": "Dune Chick",
    "disposition": "passive",
    "max_health": 5,
    "move_speed": 2.5,
    "spawn_biomes": ["sun_dunes"],
    "biome": "desert",
    "spawn_light_max": 15,
    "befriend_item": "berry_cluster",
    "calm_reward": "dune_chick_drops"
  },
  {
    "id": 14,
    "name": "sand_tortoise",
    "display_name": "Sand Tortoise",
    "disposition": "passive",
    "max_health": 16,
    "move_speed": 0.8,
    "spawn_biomes": ["sun_dunes"],
    "biome": "desert",
    "spawn_light_max": 15,
    "befriend_item": "flower_yellow",
    "calm_reward": "sand_tortoise_drops"
  },
  {
    "id": 15,
    "name": "pine_fawn",
    "display_name": "Pine Fawn",
    "disposition": "skittish",
    "max_health": 11,
    "move_speed": 3.0,
    "spawn_biomes": ["pine_forest"],
    "biome": "forest",
    "spawn_light_max": 15,
    "befriend_item": "berry_cluster",
    "calm_reward": "pine_fawn_drops"
  },
  {
    "id": 16,
    "name": "snow_bunny",
    "display_name": "Snow Bunny",
    "disposition": "skittish",
    "max_health": 6,
    "move_speed": 3.2,
    "spawn_biomes": ["frost_tundra"],
    "biome": "snowy",
    "spawn_light_max": 15,
    "befriend_item": "berry_cluster",
    "calm_reward": "snow_bunny_drops"
  },
  {
    "id": 17,
    "name": "marsh_necker",
    "display_name": "Marsh-Necker",
    "disposition": "passive",
    "max_health": 13,
    "move_speed": 1.4,
    "spawn_biomes": ["river_delta"],
    "biome": "swamp",
    "spawn_light_max": 15,
    "befriend_item": "berry_cluster",
    "calm_reward": "marsh_necker_drops"
  },
  {
    "id": 20,
    "name": "brown_bear",
    "display_name": "Brown Bear",
    "disposition": "skittish",
    "max_health": 18,
    "move_speed": 2.0,
    "spawn_biomes": ["pine_forest", "rolling_hills"],
    "biome": "forest",
    "spawn_light_max": 15,
    "befriend_item": "berry_cluster",
    "model": 12
  },
  {
    "id": 21,
    "name": "penguin",
    "display_name": "Penguin",
    "disposition": "passive",
    "max_health": 8,
    "move_speed": 1.8,
    "spawn_biomes": ["frost_tundra"],
    "biome": "snowy",
    "spawn_light_max": 15,
    "befriend_item": "berry_cluster",
    "model": 13
  },
  {
    "id": 22,
    "name": "frog",
    "display_name": "Frog",
    "disposition": "passive",
    "max_health": 5,
    "move_speed": 2.2,
    "spawn_biomes": ["river_delta"],
    "biome": "swamp",
    "spawn_light_max": 15,
    "befriend_item": "berry_cluster",
    "model": 14
  },
  {
    "id": 18,
    "name": "platypus",
    "display_name": "Platypus",
    "disposition": "skittish",
    "max_health": 7,
    "move_speed": 1.8,
    "spawn_biomes": ["river_delta"],
    "biome": "swamp",
    "spawn_light_max": 15,
    "befriend_item": "berry_cluster",
    "model": 21
  }
]
